{
  "$schema": "http://json-schema.org/draft-07/schema#",
  "$id": "https://kvm-recon.local/schema/ws-socket.schema.json",
  "title": "KVM-Recon WebSocket socket summary",
  "type": "object",
  "required": ["id", "createdAt", "url", "binaryFrameCount", "textFrameCount", "tags"],
  "properties": {
    "id": { "type": "string" },
    "createdAt": { "type": "string" },
    "closedAt": { "type": "string" },
    "url": { "type": "string" },
    "subProtocols": {
      "type": "array",
      "items": { "type": "string" }
    },
    "requestHeaders": { "type": "object" },
    "handshakeStatus": { "type": "integer" },
    "responseHeaders": { "type": "object" },
    "responseSubProtocol": { "type": "string" },
    "binaryFrameCount": { "type": "integer" },
    "textFrameCount": { "type": "integer" },
    "sampledFrameCount": { "type": "integer" },
    "droppedFrameCount": { "type": "integer" },
    "tags": {
      "type": "array",
      "items": { "enum": ["kvm-video", "vmedia", "unknown"] }
    },
    "windowRole": { "enum": ["main", "popup"] },
    "captureWindowId": { "type": "string" },
    "openerCaptureWindowId": { "type": "string" },
    "ancestorCaptureWindowIds": {
      "type": "array",
      "items": { "type": "string" }
    }
  }
}
