[
  {
    "id": "ws-1",
    "createdAt": "2026-08-24T13:55:03.000+08:00",
    "closedAt": "2026-08-24T13:55:25.000+08:00",
    "url": "wss://10.0.0.10/kvm",
    "subProtocols": [
      "binary"
    ],
    "requestHeaders": {},
    "handshakeStatus": 101,
    "responseHeaders": {
      "sec-websocket-protocol": "binary"
    },
    "responseSubProtocol": "binary",
    "binaryFrameCount": 12,
    "textFrameCount": 0,
    "sampledFrameCount": 1,
    "droppedFrameCount": 11,
    "tags": [
      "kvm-video"
    ],
    "windowRole": "main",
    "captureWindowId": "win-main"
  }
]